{
  "schema_version": "sys4ai.plan-provider-intent.v1",
  "intent_id": "PPI-EXAMPLE-001",
  "plan_id": "PLAN-EXAMPLE-001",
  "plan_sha256": "6666666666666666666666666666666666666666666666666666666666666666",
  "task_id": "TASK-REPLACEMENT-001",
  "task_sha256": "cccccccccccccccccccccccccccccccccccccccccccccccccccccccccccccccc",
  "generation": 2,
  "provider_id": "codex-app-server",
  "idempotency_key": "PLAN-EXAMPLE-001:2",
  "handoff_token_sha256": "1212121212121212121212121212121212121212121212121212121212121212",
  "predecessor_thread_id": "THREAD-PREDECESSOR-001",
  "expected_revision": 8,
  "repository_fingerprint": "1313131313131313131313131313131313131313131313131313131313131313",
  "created_at": "2026-07-18T00:00:00Z",
  "status": "returned",
  "provider_create_budget": 1,
  "create_attempts": 1,
  "returned_thread_id": "THREAD-SUCCESSOR-001",
  "provider_response_sha256": "aaaaaaaaaaaaaaaaaaaaaaaaaaaaaaaaaaaaaaaaaaaaaaaaaaaaaaaaaaaaaaaa",
  "conflicting_thread_ids": [],
  "retry_authorized": false,
  "recovery": {
    "status": "not_required",
    "reason": null,
    "evidence_refs": []
  },
  "prior_journal_sha256": "1414141414141414141414141414141414141414141414141414141414141414",
  "hash_basis": "canonical_json_without_intent_content_sha256",
  "intent_content_sha256": "d339cb03705efe36c09f2b64c18bd3f2ae81efcac001399e30acfaacdd0e65f8",
  "finalized": true,
  "extensions": {}
}
